{
  "$schema": "https://json-schema.org/draft/2020-12/schema",
  "$id": "https://openwop.dev/spec/v2/connection-pack-manifest.schema.json",
  "title": "ConnectionPackManifest",
  "description": "RFC 0095. Manifest for a published OpenWOP connection pack — `pack.json` at the pack root with `kind: \"connection\"`. Peer to and disjoint from `node-pack-manifest.schema.json` (RFC 0003), `prompt-pack-manifest.schema.json` (RFC 0028), and `workflow-chain-pack-manifest.schema.json` (RFC 0013) via the `kind` discriminator. A connection pack is a portable PROVIDER definition — the authorize/token/revoke endpoints, the read/write OAuth scope catalog, and how the integration is reached (an MCP server, an OpenAPI surface, or a core integration node). It carries NO secret: the OAuth client credential is a host concern (RFC 0047), supplied out of band. When installed, it makes an RFC 0045 connector's `auth.provider` / an RFC 0047 `host.oauth` provider string resolve against `provider.id` instead of host-locked code. See `spec/v1/connection-packs.md`.",
  "type": "object",
  "required": [
    "name",
    "version",
    "kind",
    "engines",
    "provider"
  ],
  "additionalProperties": false,
  "properties": {
    "name": {
      "type": "string",
      "description": "Reverse-DNS pack name per `node-packs.md` §Naming. Reserved scopes are identical (`core.*` / `vendor.<org>.*` / `community.<author>.*` / `private.<host>.*`). Mirror of `prompt-pack-manifest.schema.json#/properties/name`.",
      "pattern": "^(core|vendor|community|private)\\.[a-z][a-z0-9_-]*(\\.[a-z][a-zA-Z0-9_-]*)+$",
      "minLength": 1,
      "maxLength": 256
    },
    "version": {
      "type": "string",
      "description": "Pack-level SemVer 2.0.0.",
      "pattern": "^\\d+\\.\\d+\\.\\d+(?:-[0-9A-Za-z.-]+)?(?:\\+[0-9A-Za-z.-]+)?$"
    },
    "kind": {
      "type": "string",
      "const": "connection",
      "description": "Pack kind discriminator. MUST be the literal string `\"connection\"` for this schema."
    },
    "description": {
      "type": "string",
      "maxLength": 1024
    },
    "author": {
      "type": "string"
    },
    "license": {
      "type": "string",
      "description": "SPDX license identifier (e.g., `Apache-2.0`)."
    },
    "homepage": {
      "type": "string",
      "format": "uri"
    },
    "repository": {
      "type": "string",
      "format": "uri"
    },
    "keywords": {
      "type": "array",
      "items": {
        "type": "string",
        "maxLength": 64
      },
      "maxItems": 50
    },
    "engines": {
      "type": "object",
      "required": [
        "openwop"
      ],
      "additionalProperties": false,
      "properties": {
        "openwop": {
          "type": "string",
          "description": "SemVer range of the openwop spec version this pack targets."
        }
      }
    },
    "provider": {
      "type": "object",
      "description": "The portable provider definition. Exactly one per connection pack.",
      "required": [
        "id",
        "displayName",
        "category",
        "auth",
        "reach"
      ],
      "additionalProperties": false,
      "allOf": [
        {
          "$comment": "RFC 0120 UQ1: apiHosts is REQUIRED when reach is openapi (a credentialed REST/OpenAPI egress surface). A pure metadata / mcp / integration provider MAY omit it. The runtime binding-site validator (spec §Manifest item 13) is the complementary check for credentialed-egress paths the manifest cannot see.",
          "if": {
            "required": [
              "reach"
            ],
            "properties": {
              "reach": {
                "required": [
                  "openapi"
                ]
              }
            }
          },
          "then": {
            "required": [
              "apiHosts"
            ]
          }
        }
      ],
      "properties": {
        "id": {
          "type": "string",
          "pattern": "^[a-z][a-z0-9-]*$",
          "description": "Stable provider id an RFC 0045/0047 `provider` string resolves to, e.g. `github`."
        },
        "displayName": {
          "type": "string",
          "minLength": 1
        },
        "category": {
          "type": "string",
          "enum": [
            "communication",
            "docs",
            "crm",
            "dev",
            "storage",
            "email-calendar",
            "ticketing",
            "data-warehouse",
            "marketing",
            "finance",
            "hr",
            "esignature",
            "support",
            "project-management",
            "payments",
            "other"
          ]
        },
        "vendor": {
          "type": "string",
          "minLength": 1,
          "description": "RFC 0123. OPTIONAL. The commercial vendor / ecosystem this connector belongs to (e.g. \"Microsoft 365\", \"Google\", \"Workday\"). Presentational grouping ONLY — it is NOT the resolution key (RFC 0047 `provider` still resolves auth). Free-form (not an enum) so a new vendor needs no schema change; a host/registry groups connectors sharing a `vendor` under one heading and MUST fall back to the provider `displayName` when it is absent."
        },
        "auth": {
          "type": "object",
          "required": [
            "kind"
          ],
          "additionalProperties": false,
          "properties": {
            "kind": {
              "type": "string",
              "enum": [
                "oauth2",
                "api_key",
                "bearer",
                "basic"
              ]
            },
            "authFlow": {
              "type": "string",
              "enum": [
                "pkce",
                "client_credentials",
                "manual",
                "none"
              ]
            },
            "scopeModel": {
              "type": "string",
              "enum": [
                "groups",
                "coarse",
                "capabilities"
              ],
              "default": "groups",
              "description": "`groups` = read/write scope groups (Google/Jira/Graph). `coarse` = a single read-vs-write toggle (Stripe Connect read_only/read_write). `capabilities` = consent is a static developer-portal capability set, not per-request scopes (Notion)."
            },
            "endpoints": {
              "type": "object",
              "additionalProperties": false,
              "description": "Fixed, manifest-declared https endpoints (RFC 0095 §B.3). Never derived from runtime user input — not an SSRF surface.",
              "properties": {
                "authorize": {
                  "type": "string",
                  "format": "uri",
                  "pattern": "^https://"
                },
                "token": {
                  "type": "string",
                  "format": "uri",
                  "pattern": "^https://"
                },
                "revoke": {
                  "type": "string",
                  "format": "uri",
                  "pattern": "^https://"
                }
              }
            },
            "scopes": {
              "type": "object",
              "additionalProperties": false,
              "description": "Read/write scope groups. `write` is requested as a SEPARATE re-consent step (RFC 0095 §B.4).",
              "properties": {
                "read": {
                  "type": "array",
                  "items": {
                    "$ref": "#/$defs/ScopeGroup"
                  }
                },
                "write": {
                  "type": "array",
                  "items": {
                    "$ref": "#/$defs/ScopeGroup"
                  }
                }
              }
            },
            "instanceUrlTemplate": {
              "type": "string",
              "description": "For per-account-host providers (Snowflake/NetSuite/ServiceNow): a template the host fills per connection, e.g. `https://{account}.snowflakecomputing.com`. Its presence signals the provider cannot use a single global OAuth app."
            },
            "issuer": {
              "type": "string",
              "format": "uri",
              "pattern": "^https://",
              "description": "RFC 0199 §A.4/§B.3. The authorization server's issuer identifier. Fixed and manifest-declared, like `endpoints`. OPTIONAL in the schema; a host MUST NOT authorize a `reach.mcp` + `oauth2` provider whose manifest omits it (refused `connection_auth_metadata_mismatch` before any authorization URL is issued)."
            },
            "pkce": {
              "type": "string",
              "enum": [
                "S256",
                "unsupported"
              ],
              "description": "RFC 0199 §A.1. Absent or `S256` ⇒ the host sends PKCE S256. `unsupported` ⇒ no PKCE; a host MUST NOT authorize such a provider when it is reached as an MCP server (§B.2)."
            }
          }
        },
        "reach": {
          "type": "object",
          "minProperties": 1,
          "maxProperties": 1,
          "additionalProperties": false,
          "description": "Exactly ONE of mcp | openapi | integration — which core node injects the resolved credential (RFC 0095 §B.5).",
          "properties": {
            "mcp": {
              "type": "object",
              "required": [
                "server"
              ],
              "additionalProperties": false,
              "properties": {
                "server": {
                  "type": "object",
                  "required": [
                    "url",
                    "transport"
                  ],
                  "additionalProperties": false,
                  "properties": {
                    "url": {
                      "type": "string",
                      "format": "uri",
                      "pattern": "^https://"
                    },
                    "transport": {
                      "type": "string",
                      "enum": [
                        "http",
                        "sse"
                      ]
                    }
                  }
                }
              }
            },
            "openapi": {
              "type": "object",
              "required": [
                "ref"
              ],
              "additionalProperties": false,
              "properties": {
                "ref": {
                  "type": "string",
                  "description": "URL or in-pack path of the OpenAPI document for core.openwop.http.openapi-call."
                }
              }
            },
            "integration": {
              "type": "object",
              "required": [
                "node"
              ],
              "additionalProperties": false,
              "properties": {
                "node": {
                  "type": "string",
                  "description": "A core.openwop.integration.* node typeId."
                }
              }
            }
          }
        },
        "consumerNodes": {
          "type": "array",
          "items": {
            "type": "string"
          },
          "description": "The core node typeIds that consume this provider's credential (e.g. core.openwop.mcp.invoke-tool)."
        },
        "docsUrl": {
          "type": "string",
          "format": "uri"
        },
        "apiHosts": {
          "type": "array",
          "description": "RFC 0120. API host(s) a host MAY send this provider's resolved credential to for connector egress (RFC 0045). Each entry is a bare registrable hostname — lowercase ASCII, >=2 labels, TLD label beginning with a letter; no scheme, port, path, wildcard, or IP literal. Matched by dot-anchored suffix containment (request host == entry OR ends with '.'+entry); eTLD+1 is the floor and a pack MAY list a tighter exact host (e.g. googleads.googleapis.com). Omitted => no credential-bearing connector egress is reachable (fails closed). REQUIRED when reach is openapi (see the provider-level allOf).",
          "items": {
            "type": "string",
            "format": "hostname",
            "pattern": "^(?!-)[a-z0-9-]{1,63}(\\.[a-z0-9-]{1,63})*\\.[a-z][a-z0-9-]*$"
          },
          "uniqueItems": true,
          "minItems": 1
        }
      },
      "patternProperties": {
        "^(openwop-|x-|vendor\\.)": {
          "description": "Vendor / host extension escape hatch (RFC 0138). A property matching `^(x-|vendor\\.)` is a HOST EXTENSION: its semantics are unspecified by this protocol, and a consumer that does not recognize one MUST ignore it rather than reject the pack. Resolves the contradiction in `host-extensions.md` §\"Vendor-prefixed namespaces\", which requires a client receiving an unknown vendor-prefixed field to treat it as opaque — a field that `additionalProperties: false` previously made impossible to carry. SECURITY: an extension value is PACK-AUTHORED, therefore untrusted; \"ignore\" means ignore. See `node-packs.md` §\"Vendor extensions on pack manifests\" and the `pack-manifest-extension-opaque` invariant."
        }
      }
    },
    "signing": {
      "type": "object",
      "additionalProperties": false,
      "required": [
        "keyId",
        "scheme"
      ],
      "properties": {
        "keyId": {
          "$ref": "ids.schema.json#/$defs/keyId"
        },
        "scheme": {
          "const": "ed25519-canonical-json",
          "description": "RFC 0177 §C.3, RFC 0212 — one scheme: a detached 64-byte Ed25519 signature over the RFC 8785 (JCS) bytes of pack.json inside a deterministic tarball; the input MUST be I-JSON (spec/v2/core/conformance.md §Canonical JSON). method and publicKeyRef are gone."
        }
      },
      "description": "RFC 0177 §C.3/§C.4 — OPTIONAL on a bare manifest (an authoring-time pack.json exists before it is signed); when present it is the same closed { keyId, scheme } block a version manifest carries (registry-version-manifest.schema.json). The v1 { publicKeyRef, signatureRef, method } block does not exist in v2 (migration row openwop.migration.C10.1)."
    }
  },
  "$defs": {
    "ScopeGroup": {
      "type": "object",
      "required": [
        "key",
        "label",
        "scopes"
      ],
      "additionalProperties": false,
      "properties": {
        "key": {
          "type": "string",
          "pattern": "^[a-z][a-z0-9._-]*$"
        },
        "label": {
          "type": "string",
          "minLength": 1
        },
        "scopes": {
          "type": "array",
          "items": {
            "type": "string"
          },
          "description": "The provider's raw scope strings, e.g. `https://www.googleapis.com/auth/drive.readonly`."
        }
      }
    }
  },
  "patternProperties": {
    "^(openwop-|x-|vendor\\.)": {
      "description": "Vendor / host extension escape hatch (RFC 0138). A property matching `^(x-|vendor\\.)` is a HOST EXTENSION: its semantics are unspecified by this protocol, and a consumer that does not recognize one MUST ignore it rather than reject the pack. Resolves the contradiction in `host-extensions.md` §\"Vendor-prefixed namespaces\", which requires a client receiving an unknown vendor-prefixed field to treat it as opaque — a field that `additionalProperties: false` previously made impossible to carry. SECURITY: an extension value is PACK-AUTHORED, therefore untrusted; \"ignore\" means ignore. See `node-packs.md` §\"Vendor extensions on pack manifests\" and the `pack-manifest-extension-opaque` invariant."
    }
  }
}
